id,created_at,text
1058941571318644736,Sun Nov 04 04:38:39 +0000 2018,Estoy tomando antidepresivos con café ya varios dulces. Yo sé que me pueda pasar. Jelp.
1058939037396987905,Sun Nov 04 04:28:35 +0000 2018,"Nada más deja que me haga efecto el gym, el psicólogo, los antidepresivos, y entonces sí veras el partidazo que te  perdiste."
1058936903104380928,Sun Nov 04 04:20:06 +0000 2018,los antidepresivos namas traen más depresión
1058929635663249408,Sun Nov 04 03:51:13 +0000 2018,Me han vuelto a dar los antidepresivos. Vamo a ver si esta vez funcionan bien 😣
1058922948634075136,Sun Nov 04 03:24:39 +0000 2018,—Se toma sus antidepresivos.–
1058920575802851328,Sun Nov 04 03:15:13 +0000 2018,"Nommn al día gasto más en antidepresivos que en comida, legit el doble. (: :) (:"
1058919248574246912,Sun Nov 04 03:09:57 +0000 2018,En este momento solo necesito una mesa llena de antidepresivos
1058915748809191424,Sun Nov 04 02:56:02 +0000 2018,creo que deberé tomar antidepresivos de nuevo...
1058913681440935936,Sun Nov 04 02:47:49 +0000 2018,"No necesito ver Coco para deprimirme y que me suban los antidepresivos, si total mañana juega el colo"
1058906580895391745,Sun Nov 04 02:19:37 +0000 2018,@_amelight MJe alegro mucho por tu victoria. A mi este año me han sacado los antidepresivos. ¡Vamos!
1058904804129423360,Sun Nov 04 02:12:33 +0000 2018,No a los antidepresivos XD
1058903406746705921,Sun Nov 04 02:07:00 +0000 2018,weno jente a tomar los antidepresivos y a seguir estudiando nmssss
1058898256015568897,Sun Nov 04 01:46:32 +0000 2018,el alikal debería venir con antidepresivos incluídos
1058894216603070464,Sun Nov 04 01:30:29 +0000 2018,si el dinero no da la felicidad por qué tengo que pagar por los antidepresivos???
1058876110467780608,Sun Nov 04 00:18:32 +0000 2018,Dicen que el chocolate funciona como antidepresivos... Yo sólo veo que estoy engordando.
1058874300642533377,Sun Nov 04 00:11:20 +0000 2018,@jeSuisLorena @deadmantetris El consumo de ansiolíticos y antidepresivos es mucho mucho más común de lo que las personas suponen
1058860377595957249,Sat Nov 03 23:16:01 +0000 2018,"Pero mi papá considera que no necesito antidepresivos, va."
1058860312764600320,Sat Nov 03 23:15:45 +0000 2018,Fui al doctor por gastritis y salí con antidepresivos
1058847348816863237,Sat Nov 03 22:24:15 +0000 2018,Tus antidepresivos junto a los míos en la misma vitrina. No sé. Piénsalo.
1058838230882312197,Sat Nov 03 21:48:01 +0000 2018,ay ptm los orgasmos me funcionan más que mis antidepresivos how fucking jodido
1058812604817293313,Sat Nov 03 20:06:11 +0000 2018,los antidepresivos son drogas?
1058795767857643527,Sat Nov 03 18:59:17 +0000 2018,"@Anemonameba A todas las drogas psiquiátricas, benzodiacepinas, neurolépticos, hipnóticos, “antidepresivos” (sedantes emocionales)..."
1058793772388114432,Sat Nov 03 18:51:21 +0000 2018,me acabo de pasar mis antidepresivos con cerveza estoy en el fondo del hoyo
1058790969703714816,Sat Nov 03 18:40:13 +0000 2018,Mi trick or treat de este año fue un triple esquema de antidepresivos
1058775886084759552,Sat Nov 03 17:40:17 +0000 2018,"Namas deja que me haga efecto el psicólogo y los antidepresivos,  y entonces sí veras el partidazo que te perdiste. 🤷🏻‍♀️"
1058767660958343168,Sat Nov 03 17:07:35 +0000 2018,"Namás deja que me haga efecto el gym, el psicólogo, los antidepresivos, la dieta y verás como si soy un buen partido"
1058764584977350656,Sat Nov 03 16:55:22 +0000 2018,"Ayer me tome mis antidepresivos con una cerveza gallo, y dormí como nunca."
1058755902159970304,Sat Nov 03 16:20:52 +0000 2018,@_Kay_Skyler ¿Y aparte de tomar antidepresivos e ir al psicólogo que más haces con tu vida? -preguntó tras un rato degustando la comida-
1058741620298956806,Sat Nov 03 15:24:07 +0000 2018,@Skydemonhunter A ver... Los antidepresivos solo me ayudan a eso... He empezado a ir a un psicólogo ¿Sabes?
1058739806140809216,Sat Nov 03 15:16:54 +0000 2018,@Skydemonhunter Desde los antidepresivos sí
1058667627554463744,Sat Nov 03 10:30:06 +0000 2018,"@LaEtxebarria Los antidepresivos los recetan los psiquiatras, no hay una máquina expendedora de Prozac."
1058660388265517056,Sat Nov 03 10:01:20 +0000 2018,"Tinder, cerveza y antidepresivos."
1058649087036284928,Sat Nov 03 09:16:25 +0000 2018,el lunes ya bajo la dosis de antidepresivos y aaaaaaaaAAAAAAAA
1058628963986112512,Sat Nov 03 07:56:28 +0000 2018,"Me estoy volviendo a tomar los antidepresivos, pero esta vez automedicado, espero no me dañe"
1058620725685235712,Sat Nov 03 07:23:43 +0000 2018,Juro que estoy a nada de volver a tomar mis antidepresivos y mi ansiolitico.
1058603409639641088,Sat Nov 03 06:14:55 +0000 2018,Acabo de descubrir que me recetaron antidepresivos.   *se deprime*
1058580303181201408,Sat Nov 03 04:43:06 +0000 2018,Necesito que mis antidepresivos neta si me funcionen  ya me canse de valer verga.
1058567896635445248,Sat Nov 03 03:53:48 +0000 2018,"@sofiaatalavera lo que necesito no son antidepresivos, es mucho alcohol"
1058561926718992384,Sat Nov 03 03:30:05 +0000 2018,"@diego_ariasj antidepresivos, ya no estés triste jaja"
1058561519527563266,Sat Nov 03 03:28:28 +0000 2018,estoy escuchando el gato volador pa qué tomar antidepresivos si me tengo a mí misma
1058553523921674240,Sat Nov 03 02:56:41 +0000 2018,El loquero me recetó unos antidepresivos.
1058548691143966720,Sat Nov 03 02:37:29 +0000 2018,Send antidepresivos
1058543240352272384,Sat Nov 03 02:15:49 +0000 2018,Hoy comencé mis antidepresivos. Estoy muy enojado y no entiendo porqué. Toda mi empatia se desvaneció.
1058542569142009857,Sat Nov 03 02:13:09 +0000 2018,@NURIACARLOS Ya te digo. 3 años de antidepresivos llevo yo y esta en medio minuto.
1058537069969096706,Sat Nov 03 01:51:18 +0000 2018,"día 967218368 sin tomar antidepresivos, las pastillas para dormir se ven apetecibles"
1058535009081061376,Sat Nov 03 01:43:07 +0000 2018,Los cigarros son y siempre serán mis mejores antidepresivos.
1058519063692038145,Sat Nov 03 00:39:45 +0000 2018,Fui a la farmacia y por mi compra me regalaron una caja de antidepresivos.  La farmacia me dio mi calaverita.
1058514905568022528,Sat Nov 03 00:23:14 +0000 2018,mi novio me da ganas de tomarme toda la tableta de antidepresivos en un dia
1058504130652725248,Fri Nov 02 23:40:25 +0000 2018,@srita_mulan Si los mazapanes tienen chocolate te estas sobre dosificando de antidepresivos! 😂😂😂
1058493665948168192,Fri Nov 02 22:58:50 +0000 2018,Mis antidepresivos me tienen toda dormida. El pedo es que no tengo a mi novio durmiendo conmigo 24/7
1058485920951926785,Fri Nov 02 22:28:03 +0000 2018,"Le voy a decir a mi psicologa que no necesito antidepresivos, que tengo a bts *la internaban* @BTS_twt"
1058483795500908546,Fri Nov 02 22:19:37 +0000 2018,"LRT es como que un poco así funcionan los antidepresivos a veces, no???"
1058476151742418944,Fri Nov 02 21:49:14 +0000 2018,2 semanas sin antidepresivos y siento que ya me quiero suicidar.
1058471965781037057,Fri Nov 02 21:32:36 +0000 2018,Solo yo le dibujo una carita feliz al potecito de los antidepresivos ahre
1058463096388358145,Fri Nov 02 20:57:22 +0000 2018,send antidepresivos
1058460646201798656,Fri Nov 02 20:47:37 +0000 2018,@nmosqueraa Negrita y q pastillas estas tomando ?? Yo ando igual y en el iess me enviaron unos antidepresivos q no quiero tomar
1058431959414784001,Fri Nov 02 18:53:38 +0000 2018,"Si mi temblor provocado por antidepresivos ya interfiere en mi vida diaria. No me imagino en la de un cirujano, fuck depression"
1058427004394053632,Fri Nov 02 18:33:57 +0000 2018,"@Hotard_Lurker @angelmartin_nc Wna, esa wea fome ni es homeopatía xd  Te suelen dar antidepresivos y weas así xd"
1058421030123900929,Fri Nov 02 18:10:12 +0000 2018,Hoy me han dicho que tengo voz de mujer que está feliz solo por los mil antidepresivos que se toma cada día y 100% accurate.
