id,created_at,text
1062008666034003973,Mon Nov 12 15:46:11 +0000 2018,@KoffeAndTV @mei_cr Seguro fue cuando andabas en clonazepam
1062001077761921025,Mon Nov 12 15:16:02 +0000 2018,"@_CarlieYo Y que te dice ""Me cagan las clonazepam"" 😁"
1061991740842893314,Mon Nov 12 14:38:56 +0000 2018,"pasé a comprar clonazepam y por el seguro que tiene mi papá en el trabajo me salió gratis, drogas sin costo ✊"
1061991466749382656,Mon Nov 12 14:37:51 +0000 2018,@Limonada1020 Voy a alumbrar que no he almorzado y que regalo recetas de clonazepam si me traen chocolatitos
1061990588407599106,Mon Nov 12 14:34:21 +0000 2018,arroz con leche me quiero matar con una sobredosis de clonazepam
1061987528587173888,Mon Nov 12 14:22:12 +0000 2018,@javier_mdo Jajaja son gotitas de Clonazepam para dormir 😁
1061985475542597632,Mon Nov 12 14:14:02 +0000 2018,"@SANGREXENEIZE Yo me clave un clonazepam. Sabes cómo lo vi, re chill"
1061983404143591424,Mon Nov 12 14:05:48 +0000 2018,"@SANGREXENEIZE Yo clave clonazepam a lo loco. Y voy a aumentar la dosis el 24, sino no sobrevivo"
1061982774918291457,Mon Nov 12 14:03:18 +0000 2018,"Si duermo 7 horas o menos, 1/2 Clonazepam me deja dopá y tirá en cualquier esquina haciendo tuto."
1061982507791466496,Mon Nov 12 14:02:15 +0000 2018,@paco68san1 @VanDuggu Que alguien le tire un pan (y un clonazepam) a ese hueón.
1061979768168562688,Mon Nov 12 13:51:22 +0000 2018,Nada más angustiante que hacer reclamos sin clonazepam.
1061975662423093248,Mon Nov 12 13:35:03 +0000 2018,No sé si el clonazepam o la vida me tienen pa la cagá
1061951901569290240,Mon Nov 12 12:00:38 +0000 2018,Mientras el doc me médica Clonazepam..
1061941630633164805,Mon Nov 12 11:19:49 +0000 2018,Que fruta mas noble el Clonazepam
1061940808222416896,Mon Nov 12 11:16:33 +0000 2018,"Amigo tomo 4g de clonazepam al día, NO ME ATOMIZES."
1061936271248031744,Mon Nov 12 10:58:31 +0000 2018,"clonazepam por aqui clona por alla, despiértenme cuando llegue la navidadddd (y rindan por mi)"
1061928476675137536,Mon Nov 12 10:27:33 +0000 2018,Denme fuerzas para arrancar la semana y encima con efectos secundarios de clonazepam
1061902894159532032,Mon Nov 12 08:45:53 +0000 2018,me voy a tomar un blister de clonazepam porque no doy más necesito un milagro
1061886835482341376,Mon Nov 12 07:42:05 +0000 2018,a lxs que cancelan artistas 24/7 &gt;&gt; tOMENSE UNA BUENA DOSIS DE CHAMAME Y DEPASO UNA DE CLONAZEPAM
1061878029935435776,Mon Nov 12 07:07:05 +0000 2018,Me gustaría dormir sr. Clonazepam... Usted me está haciendo el efecto contrario? Maquinando a mil
1061867645321052161,Mon Nov 12 06:25:49 +0000 2018,A alguien le sobra un clonazepam? No puedo dormir...cada vez mas nerviosa cuando voy a rendir! Nerviosssssss
1061862084659548160,Mon Nov 12 06:03:44 +0000 2018,"Tengo que hacer mil cosas hoy, empiezo el día a las 8am y no me puedo dormir. Clonazepam tu me escuchas?  *inserte meme de Nelson."
1061855957586718720,Mon Nov 12 05:39:23 +0000 2018,"Y el clonazepam en la cartera, por si al caso"
1061855147154907136,Mon Nov 12 05:36:10 +0000 2018,@hil_moncada Si yo no me he muerto por tomar accidentalmente 4 clonazepam vos no vas a morir por no recordar la medicación xdxdxd
1061853829006835712,Mon Nov 12 05:30:55 +0000 2018,"Necesito dormirrrr, mañana le saco las clonazepam a la abuela"
1061851308767039489,Mon Nov 12 05:20:54 +0000 2018,"Ayer tuve una recaída fuerte: 4mg clonazepam, 30mg midazolam y 100 mg quetiapina xr. Me acosté 00, me levanté 17hs."
1061847280192536576,Mon Nov 12 05:04:54 +0000 2018,@iDianeiTv Me súper urge una sobredosis de clonazepam
1061847025136869376,Mon Nov 12 05:03:53 +0000 2018,Que mejor droga que vos mi amigo Clonazepam ....😘😍
1061846494842703872,Mon Nov 12 05:01:47 +0000 2018,"No encuentro el clonazepam, send remedios help esto es un tweet serio repito tweet serio"
1061845861100077056,Mon Nov 12 04:59:16 +0000 2018,Dios de Bendiga clonazepam Ta mañana Tengo 84 años
1061843503196573696,Mon Nov 12 04:49:53 +0000 2018,Ya denle unas clonazepam al señor que todo le caga.
1061841207188512768,Mon Nov 12 04:40:46 +0000 2018,"Estar muerto de sueño, bañado y con las sabanas limpias es igual de placentero que el clonazepam, buenas noches😴"
1061836452906987521,Mon Nov 12 04:21:52 +0000 2018,Encontré una pastilla en mi cuarto y no recuerdo si es un Clonazepam y tengo la tentación cañona.
1061831062333153281,Mon Nov 12 04:00:27 +0000 2018,"@MaatiasBaez Ribotril, Clonazepam, ribotril, Clonazepam y así pasamos los 12 días 🤙"
1061829635904888833,Mon Nov 12 03:54:47 +0000 2018,"Saludos a Clonazepam que es la única que me lee, hola vv"
1061827741195079680,Mon Nov 12 03:47:15 +0000 2018,q pasará si me tomo 20 de clonazepam mmmm
1061827686740439040,Mon Nov 12 03:47:02 +0000 2018,"@rafoarias @NetflixLAT También puedes tomar un clonazepam, mismo efecto, saludos, bye!"
1061825291730018304,Mon Nov 12 03:37:31 +0000 2018,"Tener este nivel de sueño y no poder dormir! Necesito clonazepam, ahre"
1061824094231035905,Mon Nov 12 03:32:46 +0000 2018,@Clonazepam96 uy habló @ clonazepam
1061821906326880256,Mon Nov 12 03:24:04 +0000 2018,"Llego el efecto del clonazepam, ahora podemos irnos a dormir tranquilas."
1061821666182000641,Mon Nov 12 03:23:07 +0000 2018,Soy la unica a la que el clonazepam no le hace ni cosquillas? Pregunta seria.
1061817913181646848,Mon Nov 12 03:08:12 +0000 2018,"A punto de carajearle a alguien, pasenme el clonazepam."
1061817433089040384,Mon Nov 12 03:06:18 +0000 2018,Tomaría lavandina con Clonazepam antes de volver a repetir este año de mierda.
1061814861515100161,Mon Nov 12 02:56:05 +0000 2018,"@sofigoldman bueno, si lo unico que tenes es un clonazepam  vencido te lo tomas igual seguro que no te va a hacer el mismo efecto"
1061814488289214464,Mon Nov 12 02:54:36 +0000 2018,El 24 me voy a tomar una tableta de clonazepam y birra porque así sobrio uno no puede disfrutar la situación.
1061811775807672320,Mon Nov 12 02:43:49 +0000 2018,El 24 voy a ver el partido muy serenamente tomando Fernet con Clonazepam
1061810914553487360,Mon Nov 12 02:40:24 +0000 2018,Ya llegó su clonazepam pinches depresivos.
1061810087390597120,Mon Nov 12 02:37:06 +0000 2018,Ni siquiera cuando rendí la tesis tuve tantos nervios como hoy. El 24 me inyecto clonazepam.
1061808752406552576,Mon Nov 12 02:31:48 +0000 2018,Vivo a base de clonazepam porque sino ya hubiera tenido mil ataques de nervios por las actitudes de mi vieja
1061807392818712577,Mon Nov 12 02:26:24 +0000 2018,"-Jefa, sabe si hay Clonazepam?  -Sí hay, Dr. Para qué paciente?   -Cuál paciente?"
1061803602543628289,Mon Nov 12 02:11:20 +0000 2018,"necesito 20 cajas de clonazepam, capaz se me pasa un poco el bajon"
1061800210911891456,Mon Nov 12 01:57:52 +0000 2018,la cantidad de clonazepam q me voy a tener q mandar para poder dormirme
1061797829969092608,Mon Nov 12 01:48:24 +0000 2018,Desde hoy y hasta el sábado 24 un clonazepam por día...
1061796391339601923,Mon Nov 12 01:42:41 +0000 2018,@leaynahok Más fácil y factible: media pastilla de clonazepam y una caja de vino... No te acordás ni de qué equipo sos
1061794084174602240,Mon Nov 12 01:33:31 +0000 2018,A las 22:30 me clavo el clonazepam.
1061790510296252418,Mon Nov 12 01:19:19 +0000 2018,YA SÉ DÓNDE GUARDA MI MAMÁ EL CLONAZEPAM AAAAAAAAH 😗🙌😗🙌😗🙌
1061790001166516226,Mon Nov 12 01:17:18 +0000 2018,@SANGREXENEIZE Para estar mas tranquilo después de que nos empaten en 30 segundos me tengo que tomar una carretilla de clonazepam
1061788366235164679,Mon Nov 12 01:10:48 +0000 2018,"@juanMerAll bueno, me tranquilizo, en bre algún clonazepam y adios cualquier feeling"
1061786626475601920,Mon Nov 12 01:03:53 +0000 2018,en realidad soy gorda y todo me queda pequeño 😭
1061783139289350144,Mon Nov 12 00:50:02 +0000 2018,Hola quiero decirles que soy tan pobre que solo tengo 2 remeras respetables send ropa.
1061776108822167552,Mon Nov 12 00:22:05 +0000 2018,"Tratando de no enloquecer en la ciudad, mientras el doc me medica clonazepam"
1061774617247911938,Mon Nov 12 00:16:10 +0000 2018,"Hola aca estoy de nuevo, tome el clonazepam y estoy mejor, peeo rodavia tiemblo un poco"
1061773467295588352,Mon Nov 12 00:11:36 +0000 2018,@marianoheller Estoy igual y también tomé clonazepam. Vemos mañana.
1061772538349543424,Mon Nov 12 00:07:54 +0000 2018,El día está hermoso para un licuadito de clonazepam
1061768367202295810,Sun Nov 11 23:51:20 +0000 2018,Me tuve que tomar un clonazepam para calmarme. Capaz no muero el 24 👋🏻
1061758429755138048,Sun Nov 11 23:11:50 +0000 2018,"Neta que hermoso que mi terapeuta viva tan cerca. Ya entré a la etapa de ansiedad. Send Clonazepam, paro."
1061757370534109184,Sun Nov 11 23:07:38 +0000 2018,@Miss_Clonazepam @mauriciomacri amén hermana.
1061757032448045057,Sun Nov 11 23:06:17 +0000 2018,@SAMANTA_BAXTER @edufeiok Me imagino que ya tendrá varias cajas de Clonazepam para poder conciliar el sueño después de estas palabras
1061754281768960003,Sun Nov 11 22:55:21 +0000 2018,De acá al 24 lo único que necesito es clonazepam. Muchos.
1061750434484944896,Sun Nov 11 22:40:04 +0000 2018,GRACIAS clonazepam por hacer que siga viva post partido
1061748977605980165,Sun Nov 11 22:34:17 +0000 2018,@nataliavolosin Yo drogado con clonazepam
1061748708935643136,Sun Nov 11 22:33:13 +0000 2018,Clonazepam ya te siento.
1061748450801393665,Sun Nov 11 22:32:11 +0000 2018,"@augustordlr Si fuera así de fácil, me voy a tomar una caja de clonazepam"
1061746011020951552,Sun Nov 11 22:22:29 +0000 2018,"@mauriciomacri NO TE DA LA CARA, PEDAZO DE MIERDA."
1061745973637144578,Sun Nov 11 22:22:21 +0000 2018,@jucorbalann Se tienen que tomar un clonazepam pa andar tranquilas ustedes
1061745909162299392,Sun Nov 11 22:22:05 +0000 2018,¡Dios mío! GRACIAS @clonazepam
1061744747654586368,Sun Nov 11 22:17:28 +0000 2018,Quiero ahogarme en clonazepam
1061744024657235968,Sun Nov 11 22:14:36 +0000 2018,"Mi hermano se tomo un clonazepam porque estaba nervioso por el partido, el boludo SE DURMIÓ Y SE PERDIÓ EL PRIMER TIEMPO"
1061744024657235968,Sun Nov 11 22:14:36 +0000 2018,"Mi hermano se tomo un clonazepam porque estaba nervioso por el partido, el boludo SE DURMIÓ Y SE PERDIÓ EL PRIMER TIEMPO"
1061743592312631296,Sun Nov 11 22:12:53 +0000 2018,Un 1-1 en el monumental y penales. Mañana arranco a vender clonazepam y me hago multimillonario
1061743389866188801,Sun Nov 11 22:12:05 +0000 2018,"Hay un flaco que me parece re lindo, pero siempre digo uhh no seguro es un pelotudo"
1061737386994995201,Sun Nov 11 21:48:13 +0000 2018,Para la vuelta clavo 2 clonazepam. Hoy casi no la conté
1061736111616258048,Sun Nov 11 21:43:09 +0000 2018,Gracias por sus votos pero me tomé el clonazepam y me empezó a hacer efecto en el minuto 83 🤷🏽‍♀️
1061735544722522112,Sun Nov 11 21:40:54 +0000 2018,"Ya sé que estoy en pañales y hay peores, pero por favor el capítulo final de la 6ta de Grey's ME TIRARON CON DE TODO, lloro."
1061735343525904384,Sun Nov 11 21:40:06 +0000 2018,Éstas dos semanas voy a hacer la dieta del clonazepam.
1061734159222272001,Sun Nov 11 21:35:24 +0000 2018,"@VaniBenito Te paso Clonazepam, ami jajaj"
1061731723409534976,Sun Nov 11 21:25:43 +0000 2018,dios mio no puede ser que tengamos que esperar 2 SEMANAS MAS para ver quien es campeón ni un clonazepam por dia me calma la ansiedad
1061731702484148227,Sun Nov 11 21:25:38 +0000 2018,Que alguien me facilite un clonazepam para el 24. Gracias.
1061731568102858755,Sun Nov 11 21:25:06 +0000 2018,2 Mg de Clonazepam y 2 fernet... así pasamos los primero 90 minutos
1061729506795405312,Sun Nov 11 21:16:55 +0000 2018,Necesito un clonazepam
1061728827905327106,Sun Nov 11 21:14:13 +0000 2018,el 24 me tomo una caja de clonazepam
1061728133337042945,Sun Nov 11 21:11:27 +0000 2018,Clonazepam tu me escuchas?
1061726055617216514,Sun Nov 11 21:03:12 +0000 2018,Me voy a tener que tomar una tableta de clonazepam en el próximo partido.
1061725381596721159,Sun Nov 11 21:00:31 +0000 2018,para el 24 voy a estar con sobredosis de clonazepam
1061725210670436354,Sun Nov 11 20:59:50 +0000 2018,"Si hoy sufrimos, no me imagino el 24. Clonazepam ya te 100to"
1061725137865711616,Sun Nov 11 20:59:33 +0000 2018,"A clonazepam hasta la vuelta, no?"
1061725058282983426,Sun Nov 11 20:59:14 +0000 2018,Tengo mas clonazepam que Charly Garcia en la quinta de palito ortega!
1061725037705740288,Sun Nov 11 20:59:09 +0000 2018,@brunograncara35 Listo. Me tomo un Clonazepam y llego perfecto a las 8.
1061724957279993856,Sun Nov 11 20:58:50 +0000 2018,"@ttaragui Oh! Si! Mis 0,5mg acostumbrados de clonazepam."
1061724609945485312,Sun Nov 11 20:57:27 +0000 2018,Clonazepam hasta el partido de vuelta?
1061724487010447360,Sun Nov 11 20:56:58 +0000 2018,Clonazepam urgente xfa
1061724266910175232,Sun Nov 11 20:56:05 +0000 2018,No confirmo ni niego que en esta casa compatimos hijo y clonazepam: porque the couple that does rivota together stays together.
1061724240079130624,Sun Nov 11 20:55:59 +0000 2018,Qué grita el gil de tevez
1061724036869353472,Sun Nov 11 20:55:10 +0000 2018,Al partido del 24 no lo voy a poder mirar sin tomarme antes una tableta de clonazepam
1061723842895400964,Sun Nov 11 20:54:24 +0000 2018,Denle clonazepam a Mariano Closs después de este partido
1061723376492990471,Sun Nov 11 20:52:33 +0000 2018,A estas instancias tengo 1000mg de clonazepam en sangre
1061723073102204931,Sun Nov 11 20:51:21 +0000 2018,necesito un clonazepam urgente pq me estoy muriendo
1061722152276127744,Sun Nov 11 20:47:41 +0000 2018,Policía del centro de salud: ho-  La prospera: kiero ver al doktor porke mi mamá no duerme desde ace 3 días y necesito clonazepam.
1061721856661749764,Sun Nov 11 20:46:31 +0000 2018,Voy a tener que clavarme un Clonazepam.
1061720420443975682,Sun Nov 11 20:40:48 +0000 2018,No llego al 24...ni con una caja de clonazepam 😬
1061719152614932486,Sun Nov 11 20:35:46 +0000 2018,@atlanticsurff Ah ! Bueno. 2 mg de clonazepam ?
1061719064752648195,Sun Nov 11 20:35:25 +0000 2018,Mi viejo anda re alterado lpm alguien que le pase un clonazepam
1061716906116296705,Sun Nov 11 20:26:50 +0000 2018,Un clonazepam para enzo plis
1061716787803365376,Sun Nov 11 20:26:22 +0000 2018,A Pablo Pérez lo infiltraron con clonazepam para que no lo amonesten
1061716779163099137,Sun Nov 11 20:26:20 +0000 2018,"Muestran clonazepam por el partido... Fumense un porro que es menos dañino, faloperos de mierda"
1061716011588730880,Sun Nov 11 20:23:17 +0000 2018,No hay stock de clonazepam en ninguna farmacia argentina. #infarto
1061712167085449216,Sun Nov 11 20:08:00 +0000 2018,Creo que le tome todos los Clonazepam a mi abuelo
1061711409489305604,Sun Nov 11 20:05:00 +0000 2018,Estoy pensando seriamente en tomarme un clonazepam
1061711169545793536,Sun Nov 11 20:04:03 +0000 2018,Con este partido si hubiese salido a vender Clonazepam o Rivotril por la calle me llenaba de guita la puta madre
1061711018743734272,Sun Nov 11 20:03:27 +0000 2018,Sale el cuarto Clonazepam. Vamooooo
1061711003237392384,Sun Nov 11 20:03:23 +0000 2018,El cable no llega hasta la habitación donde tengo el aire adivinen si estoy traspirando más que los hinchas de river y boca juntos.
1061710516127703040,Sun Nov 11 20:01:27 +0000 2018,Sale hospital y ese suerito con clonazepam
1061710310178996227,Sun Nov 11 20:00:38 +0000 2018,Que alguien me de mi clonazepam
1061709593561178113,Sun Nov 11 19:57:47 +0000 2018,Tengo clonazepam en una mano y el desfibrilador en la otra.
1061709403571867655,Sun Nov 11 19:57:02 +0000 2018,Bueno ahora mando clonazepam con birra de merienda.
1061709367693717506,Sun Nov 11 19:56:53 +0000 2018,las flores de bach no me estarian haciendo efecto... que deberia tomar? clonazepam? merca? diooo jajaja
1061709345627561985,Sun Nov 11 19:56:48 +0000 2018,Creo que en cualquier momento le digo a mi mamá que me dé un clonazepam
1061709305068568582,Sun Nov 11 19:56:38 +0000 2018,Clonazepam ya te siento
1061709091528208384,Sun Nov 11 19:55:47 +0000 2018,En cualquier momento me clavo un clonazepam
1061709030513672192,Sun Nov 11 19:55:33 +0000 2018,Marta tráeme un clonazepam
1061709007805734912,Sun Nov 11 19:55:27 +0000 2018,Mi vieja en cualquier momento me da un clonazepam porque no m puedo calmar jajajajajaajjaajjaaj
1061708948116516864,Sun Nov 11 19:55:13 +0000 2018,"Como les da él pulso a los ""hinchas"" para twittear mientras está él partido? Ni yo con un clonazepam me atreví a tanto."
1061708801164935173,Sun Nov 11 19:54:38 +0000 2018,La chota de mi tio como no me tome un clonazepam y dormía nomás
1061708632805593090,Sun Nov 11 19:53:58 +0000 2018,Entre ayer con mi partido de cuartos de final y hoy el partido de Boca ESTOY EXHAUSTA YA DENME DIEZ CLONAZEPAM
1061708470628614146,Sun Nov 11 19:53:19 +0000 2018,Tengo clonazepam guardado si quieren @todoelbarrio
1061708442484834306,Sun Nov 11 19:53:12 +0000 2018,"Necesito un corazón, un clonazepam y un tubo de oxígeno."
1061708437711736833,Sun Nov 11 19:53:11 +0000 2018,@SgtNestor Yo un clonazepam
1061708382359445509,Sun Nov 11 19:52:58 +0000 2018,Mamá girame un clonazepam o me muero
1061708260112322560,Sun Nov 11 19:52:29 +0000 2018,Necesito un container de Clonazepam
1061708174615633920,Sun Nov 11 19:52:09 +0000 2018,"Pasame un clonazepam para la flia, se me van"
1061707970420060160,Sun Nov 11 19:51:20 +0000 2018,"Quiero agradecer al que creó el Clonazepam, posta! Ya hubiese sufrido un paro"
1061707894129942537,Sun Nov 11 19:51:02 +0000 2018,Alguien tiene un clonazepam?
1061705729000833025,Sun Nov 11 19:42:25 +0000 2018,ustedes gritando por un maldito partido de fútbol y yo acá en mi cama drogada con clonazepam biba la bidaaaa
1061705544749277184,Sun Nov 11 19:41:42 +0000 2018,Lindo domingo para unos shots de lavandina con clonazepam ;)
1061704849035837440,Sun Nov 11 19:38:56 +0000 2018,"Por suerte, ya me tomé un Clonazepam 🐔"
1061704584530419713,Sun Nov 11 19:37:53 +0000 2018,NO PUEDO CREER ESTO
1061703460389830658,Sun Nov 11 19:33:25 +0000 2018,Vamos BOKITAAAAA!!1
1061701044600745986,Sun Nov 11 19:23:49 +0000 2018,Necesito un clonazepam
1061699646567911425,Sun Nov 11 19:18:15 +0000 2018,Vieron que una vez les recomendé té de tilo? Bueno no les está funcionando. Tómense un clonazepam amigues tuiteros nerviosos hincha huevos
1061699317143089157,Sun Nov 11 19:16:57 +0000 2018,Traeme un fernet con una tableta de clonazepam
1061697758372003841,Sun Nov 11 19:10:45 +0000 2018,solicito un clonazepam
1061697319127670785,Sun Nov 11 19:09:00 +0000 2018,"Bueno, conozco uno que se clavó un Clonazepam y se fue a dormir la siesta..."
1061695599265964032,Sun Nov 11 19:02:10 +0000 2018,"No empezó el partido y ya estamos discutiendo en casa, tramitame 30mg de clonazepam Marta."
1061695524879896576,Sun Nov 11 19:01:53 +0000 2018,Mi papá está tan nervioso que me pidió un clonazepam
1061695341479759872,Sun Nov 11 19:01:09 +0000 2018,ESTOY MUY TRANQUILA
1061694412923826177,Sun Nov 11 18:57:28 +0000 2018,Necesito un clonazepam y vino para pasar estos nervios
1061693888916844544,Sun Nov 11 18:55:23 +0000 2018,@NicolasLucca El queso relleno de clonazepam tiene un sabor ideal para estas ocasiones. En especial si fue añejado con unas gotitas de tilo.
1061693441841790981,Sun Nov 11 18:53:36 +0000 2018,Les metería una camionada de clonazepam a todos los que hace 2 hs ya están gritando 🤦🏻‍♀️
1061693345641185280,Sun Nov 11 18:53:13 +0000 2018,Necesito un clonazepam
1061693284643471367,Sun Nov 11 18:52:59 +0000 2018,ni 3 damas juanas de clonazepam me van a tranquilizar vamaaaa riveeeeerrr
1061693062357893120,Sun Nov 11 18:52:06 +0000 2018,Juega clonazepam de titular amigos
1061691635958984706,Sun Nov 11 18:46:25 +0000 2018,Andaría necesitando un clonazepam para bajar la ansiedad.
1061691535190904833,Sun Nov 11 18:46:01 +0000 2018,"Una foto mas de hincha de Boca o River mostrando clonazepam y whisky con la previa de fondo, y se suspende el partido"
1061691277580926976,Sun Nov 11 18:45:00 +0000 2018,En 15 arranca el partido y estaría necesitando un clonazepam
1061691277580926976,Sun Nov 11 18:45:00 +0000 2018,En 15 arranca el partido y estaría necesitando un clonazepam
1061689900230172673,Sun Nov 11 18:39:32 +0000 2018,"qué nervios, viejo. estoy tomando clonazepam desde las once de la mañana."
1061689516120072195,Sun Nov 11 18:38:00 +0000 2018,@NicolasLucca Ya tomas clonazepam? A los 40 te internas solo chango.
1061688224513515520,Sun Nov 11 18:32:52 +0000 2018,tramitame un clonazepam
1061688107060396038,Sun Nov 11 18:32:24 +0000 2018,"Clonazepam, hoy te convertís en héroe."
1061687569967124480,Sun Nov 11 18:30:16 +0000 2018,2 gotas de clonazepam y a sufrir. Vamos Boca 💙💛💙 #BocaxFOX
1061687115996688384,Sun Nov 11 18:28:28 +0000 2018,Necesito tomarme 10 litros de clonazepam urgente
1061683561844166656,Sun Nov 11 18:14:20 +0000 2018,"Estaba tranquilo hasta ahora, que empiece ya o voy a tener que permutar a mi gato por una caja de clonazepam"
1061683183715000322,Sun Nov 11 18:12:50 +0000 2018,No hay clonazepam que sirva por estos momentos
1061681181417181184,Sun Nov 11 18:04:53 +0000 2018,@CorruptusInExtr El clonazepam y el rivotril es lo mismo.
1061680706231902209,Sun Nov 11 18:03:00 +0000 2018,"Ahí me soplaron que el Rivotril tiene Clonazepam también, ahre"
1061678538946940928,Sun Nov 11 17:54:23 +0000 2018,no le digan a liam qué hay otro súper clásico del otro lado del charco por qué si no hay que ir a buscarlo con jeringas de clonazepam
1061675500299542530,Sun Nov 11 17:42:18 +0000 2018,Que alguien me traiga un clonazepam
1061674615129456650,Sun Nov 11 17:38:47 +0000 2018,La estoy pasando mal. Y eso que llevo 1/2 clonazepam encima.
1061673512295899136,Sun Nov 11 17:34:24 +0000 2018,Okey mi viejo me dijo que se va a tomar medio clonazepam para ver el super
1061673263473025024,Sun Nov 11 17:33:25 +0000 2018,Bueno ya fueron a comprar ese tal clonazepam para el postre?
1061670939094667264,Sun Nov 11 17:24:11 +0000 2018,&lt;———— Alguien que mande clonazepam por Rappi para esta cuenta
1061667752912535555,Sun Nov 11 17:11:31 +0000 2018,"Me tomé un clonazepam y sigo temblando, yo no se como voy a terminar vivo después de esto."
1061665627889381377,Sun Nov 11 17:03:05 +0000 2018,Faltan dos horas para el partido y mi abuela ofreciéndome clonazepam. Esto se está yendo a la mierda
1061665443855900672,Sun Nov 11 17:02:21 +0000 2018,Que clase de mente perversa puede disfrutar de esta final del orto? #VamosRiver Viviendo a clonazepam y durmiendo para la mierda!
1061664734993240065,Sun Nov 11 16:59:32 +0000 2018,Yo &lt;3 clonazepam Que rico dormi... Soy fan
1061662221028286464,Sun Nov 11 16:49:32 +0000 2018,"@BJ_pl12 @manuelitens es lo mismo rivotril es la marca y clonazepam es la droga pero si , es válido ahre jajaja vayan a yoga juntos 💕"
1061659301096448001,Sun Nov 11 16:37:56 +0000 2018,@_stop_wars_ @manuelitens Tomate un te de clonazepam y rivotril
1061657841235320832,Sun Nov 11 16:32:08 +0000 2018,Marchen licuados de Clonazepam para los fanáticos
1061656328530247681,Sun Nov 11 16:26:07 +0000 2018,Recién me acordé de la vez que una profesora contó que a la mañana bajaba el clonazepam con coca cola que contabaaaa igual same
1061655805672464384,Sun Nov 11 16:24:03 +0000 2018,¿Que van a comer en la previa del Superclásico? Yo ya puse a calentar el puré de clonazepam que me quedó de ayer.
1061654186163617792,Sun Nov 11 16:17:37 +0000 2018,Anoche me dolia MUCHO el pecho  y mi mama me encajo un clonazepam¿¿¿???
1061653807225036802,Sun Nov 11 16:16:06 +0000 2018,QUE MUJER INTENSA MI VIEJA DIOS DENLE UN CLONAZEPAM
1061653221117214720,Sun Nov 11 16:13:47 +0000 2018,"Situación a 3 horas: si no me tomo el clonazepam YA, me muero."
1061652995102924800,Sun Nov 11 16:12:53 +0000 2018,"Ahora si, traeme la sopa de clonazepam"
1061651517894246402,Sun Nov 11 16:07:01 +0000 2018,Confirmado el partido! Clonazepam para todos!
1061649700670054401,Sun Nov 11 15:59:47 +0000 2018,@sergiofilms @federix12 Es como un clonazepam futbolistico pre final (?)
1061649511674769409,Sun Nov 11 15:59:02 +0000 2018,@lavickybasso Fíjate a puro gol. Nada más que streamean ni bien empieza. Roja directa probar varios links 😐
1061646379976658944,Sun Nov 11 15:46:36 +0000 2018,"Arroz con leche me quiero matar, de una sobredosis de clonazepam."
1061645855361507329,Sun Nov 11 15:44:31 +0000 2018,Intercambio moto por tableta de clonazepam 3mg mano a mano
1061640697089060864,Sun Nov 11 15:24:01 +0000 2018,"Bueno, que alguien me traiga una cajita de clonazepam o rivotril."
1061634486432075787,Sun Nov 11 14:59:20 +0000 2018,"Buenos días, amigos, no mori después de mi primer noche con  el clonazepam, creo que ya es un gran avance. 💁🏻‍♂️"
1061632263241244672,Sun Nov 11 14:50:30 +0000 2018,@isaacfcorrales Soy más de clonazepam
1061631875712802817,Sun Nov 11 14:48:57 +0000 2018,Enseguida sale ese tal mate con clonazepam.
1061618521015246850,Sun Nov 11 13:55:53 +0000 2018,"@jorhurt @Santycuervook @jorhurtt si, si, si el clonazepam es mío, mío, mío; nene, como te pensás que sobrevivo a este gobierno garca???"
1061617648994344961,Sun Nov 11 13:52:26 +0000 2018,Me tomé un clonazepam cuando debía haber estudiado toda la noche pero no importa porque estoy como nuevaaaa
1061616061047603201,Sun Nov 11 13:46:07 +0000 2018,@Miss_Clonazepam Y tres en casa 😻
1061615188007440384,Sun Nov 11 13:42:39 +0000 2018,@yaque_estasahi Confío plenamente en vos porque tenés un gatito en la cabeza (?)
1061613452177928192,Sun Nov 11 13:35:45 +0000 2018,@GrupoFarmarket buscar clonazepam tabletas 2 mg
1061613076519284736,Sun Nov 11 13:34:15 +0000 2018,"@Miss_Clonazepam Tengo 1 mes y 4 días de 30 años y ya están mucho mejor que los 20s. Por ahora, los recomiendo."
